{
  "$schema": "http://json-schema.org/draft-07/schema#",
  "type": "object",
  "required": ["id", "title", "documents", "tasks"],
  "properties": {
    "$schema": { "type": "string" },
    "id": { "type": "string", "minLength": 1 },
    "title": { "type": "string", "minLength": 1 },
    "documents": {
      "type": "array",
      "items": {
        "type": "object",
        "required": ["id", "title", "contentFile"],
        "properties": {
          "id": { "type": "string", "minLength": 1 },
          "title": { "type": "string" },
          "contentFile": { "type": "string", "pattern": "\\.md$" }
        },
        "additionalProperties": false
      }
    },
    "tasks": {
      "type": "array",
      "items": { "$ref": "#/definitions/task" }
    },
    "resources": {
      "type": "array",
      "items": {
        "type": "object",
        "required": ["title", "url"],
        "properties": {
          "title": { "type": "string" },
          "url": { "type": "string", "format": "uri" }
        },
        "additionalProperties": false
      }
    }
  },
  "definitions": {
    "task": {
      "type": "object",
      "required": ["id", "type", "question"],
      "properties": {
        "id": { "type": "string", "minLength": 1 },
        "type": { "enum": ["choice", "open", "coding"] },
        "question": { "type": "string", "minLength": 1 }
      },
      "anyOf": [
        {
          "required": ["options", "correctAnswer"],
          "properties": {
            "options": {
              "type": "array",
              "minItems": 2,
              "items": { "type": "string" }
            },
            "correctAnswer": { "type": "string" }
          }
        },
        {
          "required": ["acceptableAnswers"],
          "properties": {
            "acceptableAnswers": {
              "type": "array",
              "minItems": 1,
              "items": { "type": "string" }
            }
          }
        },
        {
          "required": ["kind", "instructions", "criteria", "expectedFiles"],
          "properties": {
            "kind": { "enum": ["file", "project"] },
            "instructions": { "type": "string" },
            "criteria": {
              "type": "array",
              "minItems": 1,
              "items": { "type": "string" }
            },
            "expectedFiles": {
              "type": "array",
              "items": { "type": "string" }
            }
          }
        }
      ],
      "additionalProperties": true
    }
  }
}